comentario_esp,mp_tag,calidad,facilidad,materia,calif_Obtenida,fecha
Tiene conocimientos sólidos en la materia que ha adquirido por su edad estudio y experiencia Gran clase el Prof domina todo tipo de conocimientos de todos los campos de la Administración 100 recomendable aprovechen la clase las expectativas de aprobar son absolutas,BUENO,10.0,10.0,Teoría de la Organización y la Administración,10.0,05/Jun/2023
Excelente profesor para administración sabe DEMASIADO un gran Doctor es muy amable las tareas son sencillas,BUENO,10.0,10.0,Administración,10.0,20/Jul/2020
Investigador comprometido con la comprensión y explicación de la materia,BUENO,8.0,8.0,Teoría de la Organización y la Administración,9.0,30/Dic/2019
"Lo bueno todos sacan 10
Lo malo jamás ni por error se desarrolla el temario filosofa en monólogos eternos se duerme en clase y durante las exposiciones
Es buena persona pero solo eso La clase es aburridísima",MALO,2.0,10.0,SEMINARIO DE DESARROLLO DE HABILIDADES DIRECTIVAS,10.0,14/Feb/2019
No se apega mucho al temario pues gasta tiempo filosofando pero pasas por que pasas Creo que ya está un poco avanzado en edad y eso le provoca que no se enfoque en la clase y puede llegar a dormirse,REGULAR,6.0,10.0,Teoría de la Admon. y la Organización,10.0,16/Ene/2019
Actualiza permanentemente la materia,BUENO,10.0,10.0,Teoria de la Administración y la Organización,10.0,14/Feb/2018
"Lo bueno pasas por que pasas es amigable educado en general creo que es buena persona
Lo malo no toco ni de forma remota o rápida ningún tema del temario habla 3 hrs de temas como subjetivismo objetividad constructos etc nunca toma en cuenta siquiera el temario",MALO,2.0,10.0,Seminario de Desarrollo de Habilidades Directivas,9.0,13/Jun/2017
De lo mejor de la Unidad de Posgrado,BUENO,10.0,10.0,Seminario,10.0,11/Ene/2017
Inteligente y tienes un 10 seguro,BUENO,10.0,10.0,Habilidades Directivas,10.0,05/Ene/2017
Magnifico profesor Es de esos que te hacen aprender y además obtienes muy buena calificación,BUENO,10.0,10.0,Habilidades,10.0,14/Dic/2016
"Es un excelente ser humano y por demás un profesor que te ayuda a que pienses y seas crítico
Recomiendo tomar esta clase vale la pena  es un sabio",BUENO,10.0,10.0,seminario de habilidades  directivas,9.0,01/Oct/2016
Sabe mucho el tipo pero no sabe o no quiere transmitir sus conocimiento de manera clara y ordenada Falta mucho por problemas de salud,REGULAR,6.0,6.0,Desarrollo de Habilidades Directivas,10.0,12/Ene/2011
Lastima del anonimato en que se escuda una lesbiana ignorada La maestra es excelente y buena persona,BUENO,10.0,6.0,Seguridad social,9.0,03/Feb/2012
Te explica la ley paso a paso y te pone ejemplos muy padres,BUENO,10.0,4.0,seguridad social,10.0,06/Abr/2011
Muy buena maestra ayuda mucho y es clara da muchos ejemplos y es accesible La mayoria de mi grupo sacó mas de 8 aveces si es medio barco pero se compensa con sus clases que son buenas Yo si aprendí y más porque sabe enseñar y más con las Ts de conta Si llegas tarde te hace llevar dulces,BUENO,8.0,8.0,Contabilidad general y costos,10.0,05/Ene/2017
clase aburrida se la pasa leyendo diapositivas que quiere que copies pero en cuanto termina de leerlas las cambia Pide un ensayo final el cual lo deja a inicios de semestre y va pidiendo avances lo quiere escrito como si fuera tesina de titulación jaja De verdad que es aburrida su clase Zzz,REGULAR,4.0,4.0,Formulación de proyectos,7.0,10/Sep/2014
Es muy bueno la clase es un poquito lenta pero es muy clara las clases duran como maximo 130 saque 10,BUENO,10.0,10.0,Extensión Universitaria II,10.0,01/Ago/2023
Es surrealista su clase no explica nada y sólo ella se entiende Puede ser ofensiva en sus comentarios,MALO,2.0,2.0,Semiótica,9.0,25/Sep/2017
A mi me apoyo mucho y me tuvo mucha paciencia claro que yo tambien puse mucho empeño,BUENO,8.0,8.0,Investigación,8.5,22/Oct/2013
EL GORDA ES BUENA ONDA SOLO HAY QUE LLEGARLE AL PRECIO,BUENO,10.0,8.0,COSTOS,3.0,03/Dic/2010
No es barco deja tareas hace examenes y deja proyecto final Tambien tienes que entregar actividades cada clase pero es facil sacar 910 si cumples con todo,BUENO,8.0,8.0,Mercadotecnia,10.0,25/Ene/2023
Es una buena clase en general Sabe mucho del tema y es clara al explicar Prepárate para trabajar todo el tiempo en equipo,BUENO,8.0,10.0,Mercadotecnia,9.0,02/Jul/2020
EXCELENTE PROFESORA ME GUSTO MUCHO SU CLASE APRENDÍ ES MUY AGRADABLE NO ES MANCHADA A LA HORA DE CALIFICAR MUUUYY RECOMENDABLE LO MEJOR QUE TIENE EL TURNO DE LA TARDE,BUENO,10.0,10.0,MERCADOTECNIA,10.0,23/Jun/2014
Muy buena profesorasu clase es muy dinámica si asistes de manera regular no tendrás problemas con el trabajo final ya que ella lo divide en tres entregas y te va asesorando para cada una de ellas sus exámenes son muy sencillos están hechos en base a lo que se ve en clase,BUENO,10.0,8.0,Mercadotecnia,10.0,14/Ene/2014
Es tu mamá Laura jajajaja,MALO,2.0,2.0,Proyectos,7.0,31/Jul/2013
"ES UNA PROFESORA QUE SE PREOCUPA PORQUE APRENDAS SUS CLASES SON EN BASE A DIAPOSITIVAS Y SI NO LEES LAS LECTURAS DE TAREA SOLO TE VAS A ABURRIR SUS TRABAJOS SON SENCILLOS Y LAS LECTURAS SON ACTUALIZADAS
100 RECOMENDABLE LA PROFESORA",BUENO,9.0,8.0,FORMULACION,8.0,29/Jul/2013
Es una maestra muy dinámica ya que ofrece enriquece su clase con dinámicas lecturas ejercicios en clase y si es necesario hacer tareas se aprende y si la recomiendo pero no para aquellos que solo desean pasar fácilmente,BUENO,8.0,8.0,Planeación financiera,9.5,24/Abr/2013
NO TIENE ORDEN ENSEÑO TANTAS COSAS QUE EN VERDAD NO SE COMO PONERLAS EN PRACTICA TALVEZ ESO DEPENDE DE MI PERO SU CLASE SE TORNA ABURRIDA DESPUES DE TRES CLASES PARECE MATERIA DE ADMINISTRACION O CONTADURIA Y NO TE REGALA LA CALIFICACION PERO SUS EXAMENES Y TAREAS SON FACILES SIMPLEMENTE SON SUS DIAPOSITIVAS Y SUS PRACTICAS EN COMPUTADORA SON DE LO MAS ABURRIDAS,REGULAR,6.0,10.0,EVALUA.FINANCIERA PROYECT,2.0,25/Dic/2012
Es buena persona tiene buenas intenciones y de ahí la agarran de barco quiso enseñar tanto que en concreto no vimos nada esta preparada y sabe pero como que debería de apegarse al programa de la materia y ver lo que se supone deberíamos de ver ahí se lo dejo de tarea maestra,BUENO,8.0,10.0,Proyectos I,7.5,04/Jun/2012
Le pague con cuerpo y no me paso lo peor es qe no me baja,BUENO,8.0,8.0,Cinematica,1.5,26/Dic/2017
"Debes tener la costumbre de leer saber a fondo de filosofía Para nada es un profesor que te resuma los temas debes saber por tanto investigar y conocer de cultura general
Puedes aprender mucho de él además de sus múltiples publicaciones y libros lo recominedo ampliamnete",BUENO,7.0,4.0,Ciencias Políticas,9.0,27/Nov/2012
muy puntual su evaluación es sencilla pero obvio debes entregar muy  buenos reportes de práctica,BUENO,10.0,4.0,oganica 4,8.0,23/Feb/2023
"El Dr Polindara es un excelente profesor explica 
 muy bien los aspectos teóricos de las prácticas y cualquier duda la resuelve lo más pronto posible Es un poco estricto al evaluar los informes pero realmente no son difíciles le agrada que expliques las cosas a detalle",BUENO,10.0,10.0,Química Orgánica IV (Laboratorio),10.0,08/Dic/2021
A la final del día fue un buen profesor lo recomiendo mucho,BUENO,9.0,10.0,Química orgánica 1,8.5,10/Oct/2017
Es un profesor dedicado siempre puntualdeja series antes del examencualquier duda el te explica aunque no termino el temario explico muy bien todo lo que vio en clase,BUENO,10.0,8.0,Orgánica 1(teoría),8.0,25/Ene/2017
La verdad la tomé por el hecho de que la recomendaban mucho pero sinceramente no la recomiendo Siento que era forzosamente inclusiva su clase y eso me hacía sentir incomoda o harta su clase es más para personas muy sociables y con el mismo pensamiento actual no te la recomiendo si eres introver,BUENO,7.0,6.0,Cultura y Comunicación,9.0,02/Ago/2023
Disfruté bastante cada una de sus clases la profe es muy joven y siempre tiene ideas padres su clase es bastante interactiva La neta aunque soy de ingeniería sus clases se me hicieron muy disfrutables Si entregas todas las tareas las cuales son muy sencillas sin problema sacas 9 o 10,BUENO,10.0,10.0,Cultura y comunicación,10.0,01/Ago/2022
Es una profesora MUY buena se preocupa por que entiendas de lo que va la clase y se preocupa realmente el que decide si quiere aprender eres TÚ porque así pongas atención o no pongas nada de atención puedes sacar una buena calificación fácilmente con solo entregar las tareas,BUENO,10.0,10.0,Cultura y comunicación,9.0,31/Jul/2022
Es una gran persona y profesora las clases son platicas muy interesantes no es una carga excesiva de trabajo,BUENO,10.0,10.0,Cultura y Comunicación,10.0,22/Jun/2022
Una excelente profesora todo muy claro No te vas a arrepentir de tomar clase con ella ,BUENO,10.0,10.0,Cultura y comunicación,10.0,13/Oct/2021
Es un amor de persona las clases son súper interesantes que hasta la persona que menos le interese la materia terminará amando la clase no es nada difícil obtener 10 y te motivará a participar aunque no te guste Repetiría mil veces su clase,BUENO,10.0,10.0,Cultura y Comunicación,10.0,27/Ago/2021
si tienes la oportunidad TÓMALA Sus clases ufff son lo mejor al igual que ella Los temas son súper interesantes empiezas a formar un pensamiento crítico y tiene muy presente la cuestión de género sin duda la MEJOR MAESTRA QUE HE TENIDO LA AMO D,BUENO,10.0,10.0,CULTURA Y COMUNICACIÓN,10.0,23/Ago/2021
Excelente profesora te hace reflexionar y pensar Cada clase es muy interesante y te deja con muchas enseñanzas D,BUENO,10.0,10.0,Cultura y C.,23.0,20/Ago/2021
Gran profesora curse con ella cuando apenas iba empezando a dar clases en la FI Genera un gran ambiente en el salón que vuelve muy entretenida la clase y siempre con algo más por aprender Todas las actividades que realiza son muy interesantes muy fresca la clase mi pana,BUENO,10.0,10.0,Cultura y comunicación,10.0,20/Sep/2020
"Simplemente la mejor maestra
Temas claros clases interesantes y nunca te aburres Siempre te sientes cómodo de participar y preguntar cualquier cosa",BUENO,10.0,10.0,Cultura y comunicación,10.0,03/Sep/2020
El semestre en línea lo impartió en Zoom y se adaptó muy bien Es una excelente maestra y muy creativa siempre propone cosas nuevas y distintas Su clase es amena divertida y no es difícil sacar 10 pero hay que ser constante,BUENO,10.0,10.0,Cultura y Comunicación,10.0,02/Sep/2020
Es lo que todos esperamos de una clase de humanidades es sencillo sacar una buena calificación eso sí debes ganartela con trabajo continuo Sus clases son excelentes son muy entretenidas y siempre te sientes cómodo de participar,BUENO,10.0,10.0,Cultura y comunicación,10.0,25/Jun/2020
Un curso de DCSyH ideal pues permite salir con buena calificación  y aprenderás mucho sobre tu universidad y el arte Es joven y procura que el ambiente sea muy relajado y libre de preocupaciones por lo que es una buena opción para divertirse Libros exposiciones reportes de act y bitácora final,BUENO,10.0,10.0,Cultura y comunicación,10.0,20/Dic/2019
Trabajas pero vale la pena Es muy buena onda Sus clases son súper amenas No te aburres Es poca pero constante la carga de trabajo No hay exámenes La calificación final es notas de todos los temas vistos reseñas culturales una por mes reseña del palacio de minería y exposición grupal,BUENO,10.0,10.0,Cultura y Comunicación,10.0,24/Jun/2019
Son súper entretenidas las clases ya que hablan de diversos temas y además hay diferentes actividades durante el semestre muy entretenidas Excelente profesora,BUENO,10.0,10.0,Cultura y Comunicacion,10.0,01/Jun/2019
Excelente profesora explica muy bien los temas deja pocos trabajos pero interesantes y nada dificiles está genial la visita al MUNAL y al Palacio de Minería también muy padre el recorrido cultural en CU y un  rally muy buena profesora amable y divertida,BUENO,10.0,10.0,Cultura y Comunicacion,10.0,23/Ene/2018
La mejor opción para Cultura puro trabajo y no son tantos Es un amor,BUENO,10.0,10.0,Cultura y Comunicación,10.0,31/Jul/2017
Es la mejor maestra es joven por lo que te da muchos chances sus clases son interesantes te lleva por una excursión al MUNAL y al Palacio de Minería Te pone a hacer pequeñas expos y una reflexión de lo visto en clase Sacas 10 sin problemas ya que no trabajas mucho Es un amor de persona,BUENO,10.0,10.0,Cultura y Comunicación,10.0,16/Jul/2017
Muy profesional con muchos conocimientos tecnicas y actividades interesantes Se aprende bastante pero tambien hay que tranajar bastante,BUENO,10.0,6.0,Didáctica,9.0,12/Ene/2011
Es buen maestro sus clases son muy interesantesenseña todo muy claro su metodología de ir leyendo y explicando ayuda a comprender más los textos Se avienta comentarios medio locochones pero asi la clase no se hace aburrida,BUENO,10.0,10.0,Introducción a la Politica de Aristóteles,23.0,16/Mar/2017
"Cuenta con diversos grados académicos en diferentes universidades goza de una amplia experiencia fruto su trabajo y contactos lo cual enriquece enormemente sus clases

Es muy flexible y amable El desarrollo de sus clases es tedioso si no se participa aunque siempre saca alguna broma para recuperar la atención del grupo En mi opinión es de las mejores opciones que se tiene para esta materia él dio clases en maestria y aunque termina explicando otras cosas aprendes y te la pasas bien",BUENO,9.0,10.0,Gestión de Recursos Gubernamentales,9.0,09/Ene/2012
PESIMO PROFESOR MUY DESPOTA,MALO,2.0,2.0,PROYECTOS,1.0,26/Sep/2011
La Facultad de Arquitectura debería ser más estricta con el docente que acepta Personas como este señor no merecen laborar en esta prestigiosa casa de estudios,MALO,2.0,2.0,Taller integral,21.0,14/Feb/2021
la clase es muy confusa muchas veces la clase es contar sus anécdotas de su trabajo la verdad evita a esta profesor,BUENO,7.0,6.0,Química,6.0,06/Jul/2023
Vergüenza de profesor No es la opción para aprender Si quieres barquear adelante pero como no cumple sus criterios de evaluación tu calificación será al azar entre 58 Te ayuda si sacas 5 pero la máxima que pone es 8 No hay forma de pedir retroalimentación porque se desaparece y se hace menso,MALO,3.0,4.0,Laboratorio de química,6.0,25/Feb/2023
El profesor podría considerarse barco al inicio es así pero no hay que confiarse es una persona sentida y algo mamona que le encanta hacerse la víctima los exámenes valen tu calificación  pasa todos o estás en final  no sabe explicar muy bien si ya sabes química es sencillo sino piénsalo,MALO,2.0,6.0,Química,9.0,13/Feb/2023
Es grosero al principio pintaba todo bien después de unas semanas empezó a cambiar y al final de semestre cambio los criterios de evaluación a su antojo  casi todo el grupo pasó con 7 la calificación más alta fue 8 NO USES EL CELULAR EN EL LAB con 3 faltas te reprueba,REGULAR,5.0,6.0,Lab. Sistemas Químicos,7.0,10/Feb/2023
Buen profesor Evalúa de a cuerdo a lo establecido y califica  los trabajos de acuerdo a como debe ser un trabajo universitario no es tan exigente y si entregas todas las prácticas con calificaciones arriba de 7 pasas,BUENO,8.0,6.0,Lab termodinámica,8.0,15/Ene/2023
Al principio muy buena onda y todo se ve de chill pasar pero te vas a ir dando cuenta que califica como el qlo y termina por no respetar sus criterios de calificación Si explica los temas pero no es seguro que le entiendas Solo a 3 reprobó con 5 y la máxima calificación que puso fue 8,REGULAR,5.0,2.0,Laboratorio de química,6.0,05/Ene/2023
se confunde al explicar  no tiene clara ni el mismo su forma de evaluar,REGULAR,5.0,6.0,lab. quimica,8.0,27/Jul/2022
La materia es química de secundaria no mamn El prof se la pasa advirtiéndote sobre la carrera y la chamba y tiene mucha razón Puede ser pesado su lenguaje y no es el gran profesorón la vida no es como tú quieres bienvenidx al mundo,BUENO,8.0,6.0,Química,9.0,26/Ene/2022
EL p01nch3 wey ese se cree la divina comedia andante no enseña un cu1lo00000 y es un N4cc000 de remrdaa se la pasa hablando de sus p1ncghes problemas que no nos importan un caraj 0o dise muchas groserias como si estuviera en su p1nch 3 casa lo recomiendo altamente si te quier4es suicidar este año,BUENO,10.0,10.0,qUiícm9oica,21.0,03/Nov/2021
El profe es chido como persona pero enseñando no tanto al final del curso no respeto los criterios de evaluación que el mismo dio sus exámenes no estan tan dificiles pero quiere  explicacion minuciosa de cada paso mientras que el se confunde mucho explicando Si puedes evitarlo mejor,MALO,3.0,4.0,Quimica teorica,8.0,26/Feb/2021
siempre te resuelve dudas muy alegre no es difícil pasar,BUENO,9.0,10.0,lab química,9.0,12/Feb/2021
Es muy buen profesor a la hora de aclarar dudas  trata de hacer muchas reposiciones  pero eso sí no abarca todo el temario  muy buen profesor ayuda a no abandonar la carrera,BUENO,9.0,10.0,Química,6.0,25/Sep/2020
"Para el caso del laboratorio es una buena persona ya que aparte de explicarte y ayudarte a llevar a cabo la practica te platica un poco de las aplicaciones de la química ya en la industria
Si se lleva bien con el grupo es un amor es medio barrio por que a aveces se le salen groserias JAJA",BUENO,10.0,8.0,Laboratorio Quimica,9.0,09/Sep/2020
De lo peor que tiene para ofrecer la facultad peca de favoritista no sabe resolver los problemas y habla de su vida más que de la clase y los peor es que lo ponen en grupos de primer semestre en los cuales no te puedes cambiar por un profesor de verdad Pésimo,MALO,3.0,6.0,Quimica,8.0,09/Ago/2019
Nada recomendable su clase esta mal estructurada y los ejercicios los resuelve de manera muy confusa Los exámenes son muchas veces mas difíciles que los ejercicios  en clase Es muy temperamental Algunas clases las toma para hablar de su vida solamente,MALO,2.0,2.0,Quimica,9.0,25/Jul/2018
muy buen profesor y gran ser humano muy profesional sus clases son divertidas y claras con ejemplos a doc para entender el tema tratado lo recomiendo ampliamente,BUENO,10.0,10.0,lab termodinamica,9.0,20/Jul/2018
Un profesor que habla de su vida en la mayoría de las clases No cumple el temario en su totalidad Te explica más de forma matemática que de química Es divertido como persona No lo agarres de malas porque te hará la vida difícil Fácil e indisciplinado,REGULAR,5.0,6.0,Química,8.0,14/Dic/2017
No sabe nada de la clase un profesor demasiado malo pasa al que le cae bien no termina el temario si tienen la oportunidad no metan lo metan creo habla más de su vida que de la clase,MALO,2.0,8.0,Química,8.5,13/Dic/2017
Es un NACO habla de su vida califica como le da la gana estricto en los examenes a la hora de calificar si no le entiende a tu examen te manda a reposicion aunque lo tengas bien una vez mandó examen a casa a las 11 de la noche el sabado y mandarlo antes de las 8 am recomiendo para 2nda inscripc,REGULAR,6.0,6.0,quimica,8.0,24/Mar/2017
Es muy alivianado te da mucha confianza Le interesa que entiendas el tema Se salta temas y es estricto al calificar los exámenes Para recursar esta bien sólo que en sus clases se tornan aburridas aveces por que se sale del tema y cuenta historias y no te saca tarde de clases,BUENO,7.0,6.0,Química,8.0,26/Jul/2016
Siempre habla de sus historias de barrio habla con muchas groserias no da todo los temas al final hace examenes de reposicion para que pases estricto al calificar examenes le interesa que participes al final procura que pasen todos pero tienes que ganarte la calificacion consideren otro profe,REGULAR,6.0,4.0,QUIMICA,8.0,26/Jul/2016
Yo lo recomiendo para recursamiento se salta temas La verdad no te sirven por algo se los salta En sus exámenes hay que poner TODO el desarrollo sino  si baja calificación Sus exámenes ejercicios vistos en clase no son la gran cosa y si participas te ayuda,REGULAR,6.0,6.0,Química,9.0,30/Jun/2016
el mejor maestro,BUENO,10.0,10.0,ingieneria,9.0,26/Feb/2016
Empezó como un maestro buena onda pero en los exámenes se ríe de ti varias clases solo conto sobre su vida que al parecer es muy dura y solo explicaba el lab como 5 minutos antes de finalizar la clase pues como si fuera un alumno de la fi bueno pero no aprueba le pongo 5,REGULAR,4.0,6.0,Quimica,5.0,27/Ene/2016
No enseña el temario se la pasa platicando de su vida Enseña química nivel secundaria las tareas son fáciles pero califica subjetivamente Si quieres barquear metelo y pasa sus examenes que también son fáciles pero tienes que escribir todo el desarrollo hasta qué es un átomo,REGULAR,6.0,10.0,Quimica,9.0,20/Ene/2016
El peor profesor con el que he tenido el disgusto de tomar clase es un intento de comediante no sabe tomar su lugar como maestro se la pasa contando sus tontas anécdotas de vida y se salta la mitad del temario si resuelves un examen con un método distinto y él no lo entiende estás reprobado,REGULAR,4.0,4.0,Química,8.0,07/Dic/2015
Es una de la mejores profesoras de la Facultad 100 recomendable aprenderas mucho sin complicaciones sólo que si hay que trabajar,BUENO,10.0,10.0,Psicología social de la interacción,10.0,03/Dic/2010
es una super pofesora y sus clases son excelentes,BUENO,10.0,8.0,psicologia social de la interaccion,9.0,04/Oct/2010
Los demás comentarios ya dicen todo lo que se tenía que decir Excelente maestra super linda y amable muy clara y aprenderás muchísimo No dudes en cursar cualquier materia estando ella Sus ayudantes también son muy buenos,BUENO,10.0,10.0,IDO,10.0,13/Ago/2023
Nilse es de las mejores maestras que he tenido en la carrera es lindisima y es súper paciente  al explicar las tareas son algo largas pero nada del otro mundo no es barco pero es muy sencillo pasar su ayudante es muy bueno también 100 recomendada,BUENO,10.0,6.0,IDO,9.0,09/Jun/2023
Nilse es de las mejores profesoras que he tenido en la carrera es muy clara explicando y siempre ofrece ayuda sus tareas salen perfectamente con lo visto en clase y sus examenes igual,BUENO,10.0,10.0,IDO,10.0,10/Feb/2023
Excelente profesora Nilse tanto ellá como Jonatan se preocupan mucho porque aprendamos y resuelven las dudas Mi clase favorita del semestre,BUENO,10.0,10.0,IDO,10.0,08/Ene/2023
No sé porqué no tiene 10 es un amor y la más preparada para dar esta clase Sus clases son super amenas y se nota que le gusta mucho lo que hace y eso lo convierte en algo muy bonito 10000000010 sus clases verdaderamente si tienes oportunidad de cursar cualquier materia con ella no lo dudes,BUENO,10.0,10.0,Investigación de Operaciones,10.0,28/Jun/2022
La mejor clase Nilse es super clara al explicar y cualquier duda la responde Tareas un poco largas pero fáciles que se hacen en equipo Tareasexamen parecidas a las tareas pero con preguntas teóricas y prácticas Gaby es buena explicando pero empezaba tarde la clase 100 vale la pena su clase,BUENO,9.0,10.0,Investigación de Operaciones,10.0,26/Jun/2022
Es un gran curso la profesora siempre esta al pendiente de cualquier duda que tengamos y explica muy bien siempre sube las notas y clases eso si organiza bien tu tiempo y no dejes al final hacer los examenes,BUENO,10.0,6.0,IDO,10.0,24/Jun/2022
Ha sido el mejor curso que he tomado en la facultad pese a que me tocó cursar la materia en el semestre del paro la profesora siempre tuvo la mejor disposición para enseñarnos es muy clara en sus clases y siempre pregunta si hay dudas no duden en meter materias con ella vale toda la pena,BUENO,10.0,8.0,IDO,10.0,09/Feb/2022
En pandemia tuve la fortuna de tomar clase con esta maestra Realmente es clara en sus clases y óptima en su manera de evaluar Disfrutas aprendiendo y sientes que no te cuesta pasarla con buena calificación Sus ayudantes son buenas 100 recomendada,BUENO,10.0,8.0,IDO,10.0,28/Ago/2021
Es buena profesora ella da la teoría y ve ejercicios para reforzar la teoría la ayudante Gaby ve muchos ejercicios y el ayudante califca rápido las tareas,BUENO,10.0,8.0,IDO,10.0,21/Ago/2021
Recomiendo totalmente a la profesora explica claramente los temas y da ejemplos siendo semestre en Linea su manera de trabajar es lo ideal graba las clases y subes sus notas excelentes notas cabe aclarar pero si prepárate para trabajar en equipo por sus tareas no te confíes,BUENO,10.0,6.0,IDO,10.0,19/Ago/2021
"De las mejores profesoras que he tenido en la facultad es clara da ayuda y no tiene problema en explicar las cosas 
Es un curso con buen nivel sin duda lo recomendaría",BUENO,10.0,8.0,IDO,10.0,19/Ago/2021
Excelente profesora sin duda una de las mejores que he tenido en toda la facultad Sus clases son muy claras y si llegas a tener dudas te vuelve a explicar sin problemas siempre quiere que todos entiendan los temas a la perfección además de que sus exámenes son muy fáciles,BUENO,10.0,10.0,Investigación de Operaciones,8.5,01/Jul/2020
Es buena explicando aunque en un punto la clase se volvió tediosa por la falta de interés del grupo resuelve tus dudas o se lo pide a Gaby Gaby es buena ayudante pero algunas veces dan los algoritmos distinto y eso llega a confundir Solo 3 exámenes no difíciles pero de mucha talacha,BUENO,9.0,6.0,Teoría de redes,10.0,17/Ene/2020
"Nilse fue mi ayudante en IDO y su compromiso me ayudó mucho a entender la materia Explica muy bien y es muy linda para tratar de explicar las cosas de manera mas fácil  
Ayuda mucho si se lo pides    Creo que como titular es un gran elemento",BUENO,10.0,10.0,IDO,9.0,01/Ene/2020
EL MEJOR PROFESOR DE LA FACULTAD DE DERECHO DE LA UNAM,BUENO,10.0,10.0,DERECHO ADMINISTRATIVO I Y II,10.0,02/Jun/2011
Es de anatomia nuevo recien ingreso a dar catedra y pues no se comenten,REGULAR,6.0,6.0,Anatomia,9.0,01/Mar/2011
Califica tan estricto el aparato crítico que no te deja ni expresar tus propias ideas,REGULAR,5.0,8.0,Análisis de conytuntura,8.0,25/Ago/2017
