comentario_esp,mp_tag,calidad,facilidad,materia,calif_Obtenida,fecha
"Un PROFESOR en todo el sentido de la palabra Comprometido con la dosencia y con los alumnos Siempre prepara las clases y resuelve dudas Tiene espiritu siempre alegre Gran persona dentro y fuera del aula
Ampliamente recomendado D",BUENO,9.0,8.0,Biodiversidad -  CT,10.0,28/Jul/2014
Excelente Maestro Lo recomiendo ampliamente es muy bueno y muy integrativo en sus conocimientos Además es muy didáctico y muy dinámico está bien loco en el buen sentido de la palabra,BUENO,10.0,8.0,Paleobiología,10.0,02/May/2013
EXCELENTE PROFESORA,BUENO,10.0,10.0,ÁLGEBRA LINEAL,9.0,23/Oct/2019
Es excelente dando clase muy fácil de entender da muchos puntos extra sus exámenes y tareas son al nivel es buena onda pero no te debes de confiar por eso,BUENO,10.0,8.0,Álgebra lineal,7.0,18/Oct/2017
La mejor maestra del anexo,BUENO,10.0,8.0,Algebra LIneal,10.0,15/Ago/2017
Muy buena profesora pero se va algo rápido es importante que no te confíes para sus exámenes porque no son muy fáciles Deja muchos ejercicios tareas y proyectos que al final se suman a tu calificación Es un amorcito pero tienes que poner mucha atención para no perderte en su clase,BUENO,9.0,8.0,ALGEBRA LINEAL,10.0,26/Jul/2016
Es una pofesora muy amable y linda enseña muy claro aunque va algo rápido Lo recomendable en su clase es entregar todas las tareas resumenes series etc que solicite ya que lo único obligatorio son los examenes parciales y quincenales creeme al final lo vas a agradecer OJO no es barco,BUENO,10.0,8.0,Álgebra lineal,9.0,05/Jun/2016
De los mejores profesores de la facultad es sencillo pasar con ella pero te de un buen nivel para lineal donde dicen es mejor su serie son ejercicios de finales pero con lo bien que explica es lo único que necesitas da puntos extras por trabajos y muy accesible en contra esta su impuntualidad y se atrasa un poco Recomendable,BUENO,10.0,10.0,Algebra,9.0,09/Jul/2015
Es una excelente personamuy amable de las pocas clases que se disfrutan contesta todas las preguntas resuelve dudas y aunque reprobaras con ella se adquieren todas las armas para presentar un extraordinario y sacarlo perfectamente porque explica muy bien 100 RECOMENDADA,BUENO,10.0,8.0,Algebra,10.0,15/Sep/2013
es una persona muy humana y exageradamente amable muy recomendable si tienes dudas ella te ayuda o te guia para que encuentres por supuesto muy recomendable,BUENO,9.0,8.0,geometria,9.0,29/Jun/2013
excelente profesora y excelente persona muy linda muy amable,BUENO,10.0,6.0,algebra lineal,10.0,22/Feb/2012
Excelente profesora,BUENO,10.0,10.0,Àlgebra Lineal,10.0,06/Oct/2011
es super buenisima maestra,BUENO,10.0,8.0,algebra,9.0,04/Feb/2011
En general es excelente maestra explica de manera muy clara sin embargo los ejercicios de los examenes los pone con un nivel de dificultad un poco mas alto que los vistos en clase Lo que mas vale es hacer las tareas aunque te diga que son opcionales,BUENO,10.0,8.0,geometria analitica,10.0,07/Jul/2010
"Definitivamente uno de los mejores docentes en la UNAM su amplia y diversa formación académica se ve reflejada en todas y cada una de sus cátedras
Siempre esta dispuesto a apoyar tu proceso de formación y ves temas complementarios de actualidad  y de utilidad
Lo recomiendo ampliamente",BUENO,10.0,10.0,Teoría Social,9.0,28/Feb/2019
Participa y entrega los trabajos diapositivas en power point y estas del otro lado El trabajo final lo requiere breve pero muy conciso ya que lee todos los trabajos,BUENO,10.0,8.0,"LENGUAJE, CULTURA Y PODER",9.0,12/Ago/2022
Es de los mejores profesores que he tenido y es un profecional en la Psicología ya que nos enseña muchas herramientas para aprender y trabajar gracias,BUENO,10.0,10.0,psicologia comunitaria,9.5,25/Abr/2012
La profesora a pesar de que explica las cosas a veces de forma un poco confusa sabe bastante Aprendes con ella si haces las tareas que son MUCHAS Si tienen alguna duda pregúntenle ella esta dispuesta a ayudar y lo hace bien,BUENO,7.0,4.0,Electricidad y Magnetismo,9.0,02/Feb/2022
Es muy mala a menos que te guste trabajar puesto que deja muchisima tarea no explica bien y de repente se vuelve tediosa su clase,REGULAR,4.0,2.0,Electricidad y Magnetismo,8.0,23/Ene/2020
"No la metan es pésima nadie sale con 10 solo 6 7 y 8 pero es porque no explica y deja muchas tareas 
Te pone a exponer y de ahí hace exámenes mejor metan Portilla",MALO,2.0,2.0,Electricidad y magnetismo,7.0,27/Nov/2019
"Sus clases están de flojera califica como maestra de primaria no explica y pone ejercicios de exposiciones de compañeros a los que no se les entiende nada 
Deberían aplicarle una evaluación porque no es apta para ser maestra",MALO,2.0,2.0,Electricidad y magnetismo,8.5,02/Sep/2019
La maestra sí sabe pero todas sus clases ya las trae escritas se basa en su cuaderno Pero todo lo que te enseña lo vas a utilizar toda la carrera en serio Todo lo que vi con ella lo sigo aplicando aún en estructuras discretas La recomiendo mucho es tediosa aburrida deja mucho trabajo,BUENO,7.0,6.0,Álgebra,8.0,27/Sep/2015
Pues la Ing no es mala lo que pasa es que pareec novata o no sabe explicar muy bien Aveces los mismos alumnos la tenemos que estar corrigiendo de unos simples errores Pero bueno hace el esfuerzo por que aprendasDeja muchas tareas muy fáciles por lo regular definiciones ó ejercicios toma en cuenta la asistencia y las tareas es facil pasar con ella y si aprendes pero tambien le tienes que poner de tu parte para cubrir bien el curso Sus examenes son muy faciles viene todo lo que explica,REGULAR,6.0,10.0,algebra,8.0,12/Ene/2011
Las clases las da sin una guía de lo que se verá durante el curso suele tener la palabra durante todo el mismo el trabajo que se desarrolla durante las clases no es muy claro y lo que aportes nunca va a estar bien pero al final califica súper barco sin saber bien qué calificó,MALO,3.0,8.0,Seminario de Estrategia Empresarial,10.0,04/Sep/2023
Un mal profesor ya no debería impartir clase esta en la UNAM porque el sindicato lo protege Tiene el conocimiento pero enseña mal es arrogante te confunde Nada le parece solo lo que el dice esta bien aunque se demuestre lo contrario No recomendable en esta materia,REGULAR,6.0,6.0,Seminario de Estrategia Empresarial,9.0,28/Jul/2022
de los mejores profesores que he tenido  es exigente pero la retribucion que imparte es grande te recomienda libros muy buenos y es accesible,BUENO,9.0,10.0,habilidades directivas,8.0,29/Mar/2022
Acosador es como mejor se le describiría,MALO,2.0,2.0,CONTEXTOS DE ADMINISTRACIÓN,24.0,09/Sep/2021
Sus criterios de evaluación no son claros califica dependiendo de cómo le caigas si le haces la barba te califica bien en general se molesta si le pides retroalimentación y cuando la da hace comentarios muy ambiguos que no suman a la mejora de tus trabajostodo lo que entregues estará mal,MALO,3.0,4.0,Seminario de estrategia empresarial,8.0,24/Jun/2021
Le gusta ser practico a la  hora de redactar ideas sino sabes nada de Marketing no te metas porque da la clase suponiendo que ya  sabes y te puedes perder es muy fácil pasar no te exige que leas pero si no eres autodidacta  para lo que te pide te vas a fustrar,REGULAR,5.0,8.0,Estrategia empresarial,10.0,03/Feb/2021
NUNCA ESTA BIEN LOS TRABAJOS QUE HACES TIENE UN CARÁCTER MUY DURO NO LO RECOMIENDO,MALO,2.0,2.0,ESTRATEGIA EMPRESARIAL,6.0,27/Ago/2020
Mi Tutor de tesis Simplemente excelente,BUENO,10.0,10.0,Habilidades Directivas,9.0,21/Oct/2019
Ha leído mucho hay cosas que enseña que valen la pena pero durante el semestre puedes reirte de lo que no entiendes o desesperarte Las tareas nunca nadie las hace  bien los exámenes tampoco y desde el principio te dice que vas a reprobar  La mayores calificaciones son para quienes participan,REGULAR,5.0,4.0,Habilidades directivas,9.0,27/Jul/2016
Excelente estricto pero justo me encantó su materia en la maestría  lo recomiendo ampliamente como asesor,BUENO,7.0,2.0,Sistemas,10.0,23/Ene/2015
Es uno delos maestros que dejan huella en ti por bueno o por malo según decidas pero le debo mi titulo de MAO y como persona es excelente lo recomiendo te va a servir no solo para la materia sino para tu vida personal y profesional lo califico con 95,BUENO,10.0,6.0,habilidades directivas,9.5,09/Ago/2014
Fue la mejor materia que tuve en el semestre Si es algo raro pero esa rareza lo hace especial y para mi fue aprender cosas para la vida Puede ser que de pronto sientas que no aprendes mucho pero sus momentos de lucidez son lo que vale la pena y depende de ti tambien,BUENO,8.0,4.0,Seminario de desarrollo de habilidades directivas,10.0,15/Ene/2014
No se les ocurra inscribirse con este profesor además de exigir mucho tiempo nunca revisa lo solicitado y todas tus tareas siempre están mal hechas busca otro profesor con el que aprenderás más y tendrás mejor calificación,MALO,2.0,2.0,Habilidades Directivas,8.0,07/Ene/2014
Repite siempre lo mismo da los mismos ejemplos cada clase Para él todos son mediocres y no saben leer ni aprovechar lo mucho que sabe,MALO,2.0,2.0,Habilidades Directivas,3.5,04/Dic/2013
Excelente mAESTRO CON EL APRENDÍ REALMENTE LO QUE ES LA ADMINISTRACIÓN Y COMO APLICARLA CORRECTAMENTE EN LAS EMPRESAS yO LO TUVE EN UPIICSA 3 AÑOS,BUENO,10.0,2.0,ADMINISTRACIÓN,9.0,26/Nov/2013
Es un profesor distinto el que más recuerdo de la universidad Sólo necesitas ser creativo y práctico,BUENO,7.0,8.0,Dirección estratética,8.0,21/Ago/2013
Es un lunático ignoro por qué la Maestría en organizaciones tiene a este profesor no inspira ni enseña su temario y sus explicacaciones están fuera de tema y de la realidad,MALO,2.0,2.0,Desarrollo de habilidades gerenciales,2.0,27/Ago/2012
El mejor profesor que he tenido,BUENO,10.0,6.0,MAF,9.0,20/Ene/2023
Muy buen profesor,BUENO,10.0,10.0,Analisis Complejo,10.0,20/Ene/2022
Resulta un tipo muy agradable y dispuesto a ayudarte sí lo solicitas no obstante carece de aquella habilidad docente para llamar la atención del púiblico,REGULAR,6.0,8.0,EDA,7.0,24/Feb/2018
Es un amor 333,REGULAR,6.0,4.0,Estructura de datos y algoritmos I,4.5,16/Feb/2017
El mejor maestro que he tenido,BUENO,10.0,10.0,Latín,9.0,11/Sep/2023
Nunca asiste a clases se saca calificaciones de la manga,MALO,2.0,2.0,Latín,24.0,24/Jul/2022
Tuvo la facilidad de estudiar en Heidelberg y otras Universidades lo cual le dio Método para aprender y enseñar con mayor claridad y eficacia Es muy crítico pero siempre ayuda,BUENO,9.0,6.0,Griego antiguo,9.0,03/Sep/2012
No lo haga compa,BUENO,7.0,2.0,Programación Orientada a Objetos,8.0,16/Ene/2019
Su trabajo sí es de los que te pone a pensar y a sufrir un poco a final de semestre pero la verdad es que es una clase en la que repetiría si diera en los siguientes semestres Es empático y se muestra con interés por los temas y las impresiones que propone el grupo,BUENO,10.0,6.0,Teorías y análisis del discurso,9.0,06/Ago/2021
Los tuve en primer y segundo semestre El segundo semestre fue en línea y sí se entendía es teoría pero la hace interesante,BUENO,10.0,6.0,Teorías y análisis del discurso,9.0,14/Sep/2020
lo recomiendan con amplia experiencia en materia penal civil y mercantil,BUENO,10.0,10.0,derecho,10.0,15/Abr/2021
El profe es de lo mas amable  respetuoso que la fi tiene  siempre dispuesto a motivarte y que aprendas si bien ya esta algo grande de edad por eso no se escucha tanto  pero el profesor es de lo mejor  no duden en meterlo  evalua decente y facil,BUENO,10.0,10.0,Ingenieria de Software,10.0,19/Ago/2023
El profe ya está grande y se la pasa leyendo su presentación por lo que te duermes eso si caba las clases temprano Haz los quizzes avanzale al proyecto luego ya ni sabes qué onda y procura llevar tu lap el día del examen Nadie sacó 10 pero un 8 o 9 te llevas,REGULAR,6.0,10.0,Ingeniera de Software,8.0,17/Ago/2023
Este señor deberia dar mas materias hay muchas materias para compu que son inutiles actualmente y lo mejor es barquearlas para aprender por tu cuenta para tu futura vida laboral este maestro hace eso posible te libera tiempo y te ayuda en el avance No esperes aprender algo solo es para pasar,BUENO,10.0,10.0,Ingeniería del software,8.0,21/Jul/2023
Si quieres aprender EDA 1 no es la opción hay nulo aprendizaje es buena persona y se ve que sabe pero no lo sabe transmitir de manera interesante y clara si quieres pasar es opción si quieres aprender no,REGULAR,5.0,10.0,EDA 1,9.0,24/Jun/2023
Titanic sus clases son súper relajadas y el profe sabe muchas cosas interesantes tqm Adán,BUENO,10.0,10.0,EDA I,10.0,06/Feb/2023
Ah mí viejito hermoso que sea eterno esta es la opción si te urge pasar cualquier materia que da Su clase es para que entres a relajarte leer dibujar dormir No te confíes asiste a todas las clases y rifate los exámenes el de lab y el teórico esos son tu calificación no revisa prácticas,REGULAR,6.0,10.0,EDA I,7.0,30/Ene/2023
El profe si sabe de la materia pero muchos ya lo agarraron de barco sin embargo sabe mucho y te va a responder la duda que sea lo unico malo de su clase es que te gana el sueño xd Es facil paasar con el,BUENO,10.0,10.0,POO,9.0,18/Ene/2023
De hu3v4 la clase neta no es mentira No vas a aprender nada pero como hay pocos profes ps lo cursé No me gustó su clase para nada tampoco lleva reciclando sus prácticas desde hace 7 años y a nosotros nos regaña por investigar por aparte en internet,REGULAR,4.0,8.0,POO,8.0,15/Ene/2023
"Clase con diapositivas realmente nunca dio un algoritmo o ejemplo práctico y dejaba sus prácticas de un día para otro solo al final del curso dejaba al menos el código para armar la práctica 

Para barquear no aprendí nada pero da buena idea de qué buscar por cuenta propia",REGULAR,6.0,10.0,EDA 1,10.0,08/Jun/2022
"La neta si solo piensas barquear esta materia este es el profe De lo contrario no lo recomiendo mucho ya que sus clases son extremadamente aburridas 

Parece como si hablara consigo mismo y pues al final pasas pero sin saber mucho ",BUENO,7.0,10.0,Ing. Software,9.0,27/Ene/2022
Es él platicando sus diapositivas pero se aprende bastante Cada clase se hace un trabajo en equipo el cual es el proyecto no lo dejen al ultimo bastante sencillo de hacer deja Quizzes que se responden sus presentaciones Solo un examen bastante facilConsejo hagan equipo con personas responsa,BUENO,10.0,10.0,Ingeniería de Software,9.0,11/Ene/2022
No sé por qué se quejan tanto los otros es un buen profesor Se aprende mucho en las prácticas que hace y todas las dudas que tienes te las resuelve Si te falló algo en las prácticas puedes ver después cómo se hace y aprendes de eso,BUENO,9.0,6.0,Programación Orientada a Objetos,23.0,24/Nov/2021
Muy bueno el profe la verdad no es payaso por lo que no vas a tener problemas con calificación injusta o trabajosexámenes excesivos Es agradable y solidario con nosotros por temas de pandemiaparos Una muy buena opción,REGULAR,6.0,10.0,EDA 1,9.0,27/Ago/2021
Sus clases son sólo con diapositivas es muy fácil que te distraigas yo no aprendí nada con él Es fácil pasar con buena calificación te ayuda cuando se lo pides y la verdad es una muy linda persona muy inteligente sin embargo sus clases son aburridas,REGULAR,5.0,8.0,Estructura de datos y algoritmos,10.0,01/Sep/2020
Califica mal su clase solo son las diapositivas no vale la pena quemar su inscripción,MALO,2.0,2.0,Poo,5.5,20/Ago/2020
asco de profe,MALO,2.0,2.0,poo,5.0,28/Ene/2020
pesimo profesor,MALO,2.0,2.0,poo,5.5,28/Nov/2019
Es medio barco pero no te va a dejar nivel las clases son un poco aburridas pero todo lo que venga en sus presentaciones vendra en su examen El laboratorio es opcional pero es recomendable hacer las practicas,BUENO,7.0,8.0,Programacion Orientada a Objetos,8.0,28/Jun/2018
Sus clases son algo aburridas porque las da con pura presentación Es muy fácil pasar con el y obtener buena calificación saldrás con buen nivel si haces todas sus prácticas y te interesas en sus clases,BUENO,9.0,8.0,Programación Orientada a Objetos,8.0,28/May/2017
Su clase es muuuy aburrida al final ya ni le haces caso No le interesan las practicas y sus examenes son my faciles hasta eso pero si hay que chutarce todas sus diapositivaspiensas que no pasaras al final  por que realmente ni sabes que te evalua por que no hacen nadanolorecomiendo,REGULAR,6.0,8.0,Orientado a objetos,8.0,02/Feb/2017
La verdad se me hizo muy aburridas sus clases a tal grado que lo deje de escuchar y solo me sentaba atrás talvez si explique bien  pero necesitas estar muuuy atento no es difícil pero hace que la materia se te haga tediosa,MALO,2.0,10.0,Orientado a objetos,23.0,26/Nov/2016
Es facil pasar con el porque califica con examenes que son muy faciles porque te da guias pero es muy importante que pongas empeño,BUENO,8.0,10.0,Estructura y Algoritmos (2016),9.0,09/Ago/2016
El comentario de abajo miente,MALO,2.0,2.0,POO,24.0,18/Ene/2023
Excelente profesor,BUENO,8.0,6.0,POO,8.0,26/Nov/2016
SU CLASE DEPENDE DEL HUMOR DEL QUE LLEGUE PUEDE IR DE MUY AGRADABLE A UNA VERDADERA BRUJA NO SE SI ES BIPOLAR O SOLO HISTERICA CUANDO ESTA DE BUENAS NO SON TAN MALAS SUS CLASES,MALO,3.0,2.0,FARMACOLOGIA VETERINARIA,8.5,10/Ene/2017
Como buen amigo y socio del depredador sexual  Victor Pavon Villamayor es un acosador de las compañeras y sus clases son de ego y de como fue baby boomer sin merecerselo,BUENO,7.0,6.0,Eco de la empresa,7.0,21/Mar/2023
Servidor público corrupto y como profesor pésimo Como dicen con las mujeres es un acosador,MALO,2.0,2.0,Eco,24.0,14/Oct/2022
Aguas si eres mujer Es un cerdo Me buscó en redes sociales despues de que se acabó el curso para insinuarse A los directivos les vale aún si tienes capturas de pantalla,REGULAR,4.0,4.0,Eco emp,9.0,22/Abr/2022
Saca sus ejercicios de wikipedia es un profesor acosador de alumnas su adjunta pseudo feminista lo solapa,MALO,2.0,2.0,Economía industrial,7.0,11/Ago/2021
El profesor tiene cierto prestigio y es autoridad en el tema pero nunca dejo claro los aspectos de evaluación hizo un solo examen a mitad del semestre y con eso evaluó todo como te haya ido en ese examen define todo normalmente platica de sus experiencias laborales No pone NP Si sacaste 6 o 7,MALO,3.0,10.0,Economía de la Empresa,6.0,11/Feb/2021
Está muy desactualizado Es buena onda pero no pasa de los casos que hizo hace 20 años,BUENO,7.0,6.0,Competencia económica,8.0,23/Dic/2018
Excelente profesor de los mejores de la facultad  el curso es sobre política de competencia económica  fortaleces aspectos de EC Industrial y Microeconomia  es un profesional y sabe de lo que habla se realiza estudios de caso saldras con excelente nivel de micro recomendable,BUENO,9.0,6.0,Economía de la Empresa,7.0,03/Jul/2018
Cuando hizo examen y dijo que el promedio de los examenes pasados era 4 me rei despues cuando saque 25 entendi porque Examenes dificiles pero es buen profe,REGULAR,4.0,2.0,Eco de la Empresa,5.0,12/Nov/2016
"esta de hueva la clase no enseña nada solo de los trabajos que ha hecho
se la pasa hablando de si mismo o de otros profesores y mal",MALO,3.0,4.0,empresa,1.0,21/May/2014
Es muy egolatra y solo habla de el pero es chido y no es tan mala la clase,REGULAR,6.0,6.0,eco. emp.,8.0,14/Ene/2014
Sus investigaciones en el campo de la regulación económica hacen de esta clase una revisión de cada uno de ellos analizando y criticandolos mediante modelos microeconómicos y econometría Son dos exámenes cada uno de 9 hojas para los cuales te da 3 horas para contestar El profe es muy accesible,REGULAR,5.0,4.0,Economía de la empresa,7.0,22/Dic/2013
